2000s,"The Colombian Armed Conflict continues causing deaths and terror in Colombia. Beginning in 1964, the FARC and ELN narcoterrorist groups were taking control of rural areas of the country by the beginning of the decade, while terrorist paramilitaries grew in other places as businesspeople and politicians thought the State would lose the war against guerrillas. However, after the failure of the peace process and the activation of Plan Colombia, Álvaro Uribe Vélez was elected president in 2002, starting a massive attack on terrorist groups, with cooperation from civil population, foreign aid and legal armed forces. The AUC paramilitary organization disbanded in 2006, while ELN guerrillas have been weakened. The Popular Liberation Army demobilized while the country's biggest terrorist group, FARC has been weakened and most of their top commanders have been killed or died during the decade. During the second half of the decade, a new criminal band has been formed by former members of AUC who did not demobilize, calling themselves Aguilas Negras. The Sierra Leone Civil War (1991–2002) came to an end when the Revolutionary United Front (RUF) finally laid down their arms. More than two million people were displaced from their homes because of the conflict (well over one-third of the population) many of whom became refugees in neighboring countries. Tens of thousands were killed during the conflict. The Sri Lankan Civil War (1983–2009) came to an end after the government defeated the Liberation Tigers of Tamil Eelam. Over 80,000 people were killed during the course of the conflict. War in North-West Pakistan (2004–present) – an armed conflict between the Pakistani Armed Forces and Islamic militants made up of local tribesmen, the Taliban, and foreign Mujahideen (Holy Warriors). It began in 2004 when tensions rooted in the Pakistani Army's search for al-Qaeda members in Pakistan's mountainous Waziristan area (in the Federally Administered Tribal Areas) escalated into armed resistance by local tribesmen. The violence has displaced 3.44 million civilians and led to more than 7,000 civilians being killed."
2000s,"The Angolan Civil War (1975–2002), once a major proxy conflict of the Cold War, the conflict ended after the anti-Communist organization UNITA disbanded to become a political party. By the time the 27-year conflict was formally brought to an end, an estimated 500,000 people had been killed. Shia insurgency in Yemen (2004–present) – a civil war in the Sada'a Governorate of Yemen. It began after the Shia Zaidiyyah sect launched an uprising against the Yemeni government. The Yemeni government has accused Iran of directing and financing the insurgency. Thousands of rebels and civilians have been killed during the conflict. Somalia War (2006–2009) – involved largely Ethiopian and Somali Transitional Federal Government (TFG) forces who fought against the Somali Islamist umbrella group, the Islamic Court Union (ICU), and other affiliated militias for control of the country. The war spawned pirates who hijacked hundreds of ships off the coast of Somalia, holding ships and crew for ransom often for months (see also Piracy in Somalia). 1.9 million people were displaced from their homes during the conflict and the number of civilian casualties during the conflict is estimated at 16,724. Somali Civil War (2009–present) – involved largely the forces of the Somali Somali Transitional Federal Government (TFG) assisted by African Union peacekeeping troops, whom fought against various militant Islamist factions for control of the country. The violence has displaced thousands of people residing in Mogadishu, the nation's capital. 1,739 people in total were killed between January 1, 2009, and January 1, 2010."
2000s,"Conflict in the Niger Delta (2004–present) – an ongoing conflict in the Niger Delta region of Nigeria. The conflict was caused due to the tensions between the foreign oil corporations and a number of the Niger Delta's minority ethnic groups who felt they were being exploited, particularly the Ogoni and the Ijaw. The competition for oil wealth has led to an endless violence cycle between innumerable ethnic groups, causing the militarization of nearly the entire region that was occupied by militia groups as well as Nigerian military and the forces of the Nigerian Police. Algerian Civil War (1991–2002) – the conflict effectively ended with a government victory, following the surrender of the Islamic Salvation Army and the 2002 defeat of the Armed Islamic Group. It is estimated that more than 100,000 people were killed during the course of the conflict. Chadian Civil War (1998–2002) – involved the Movement for Justice and Democracy in Chad (MDJT) rebels that skirmished periodically with government troops in the Tibesti region, resulting in hundreds of civilian, government, and rebel casualties. Chadian Civil War (2005–2010) – involved Chadian government forces and several Chadian rebel groups. The Government of Chad estimated in January 2006 that 614 Chadian citizens had been killed in cross-border raids. The fighting still continues despite several attempts to reach agreements. Nepalese Civil War (1996–2006) – the conflict ended with a peace agreement was reached between the government and the Maoist party in which it was set that the Maoists would take part in the new government in return for surrendering their weapons to the UN. It is estimated that more than 12,700 people were killed during the course of the conflict."
2000s,"Second Liberian Civil War (1999–2003) – The conflict began in 1999 when a rebel group Liberians United for Reconciliation and Democracy (LURD), with support from the Government of Guinea, took over northern Liberia through a coup. In early 2003, a different rebel group, the Movement for Democracy in Liberia, emerged in the south. As a result, by June–July 2003, president Charles Taylor's government controlled only a third of the country. The capital Monrovia was besieged by LURD, and that group's shelling of the city resulted in the deaths of many civilians. Thousands of people were displaced from their homes as a result of the conflict. Insurgency in the Maghreb (2002–present) – Algeria has been the subject of an Islamic insurgency since 2002 waged by the Sunni Islamic Jihadist militant group Salafist Group for Preaching and Combat (GSPC). GSPC allied itself with the Al-Qaeda Organization in the Islamic Maghreb against the Algerian government. The conflict has since spread to other neighboring countries. Ituri conflict (1999–2007) – a conflict fought between the Lendu and Hema ethnic groups in the Ituri region of northeastern Democratic Republic of Congo (DRC). While there have been many phases to the conflict, the most recent armed clashes ran from 1999 to 2003, with a low-level conflict continuing until 2007. More than 50,000 people have been killed in the conflict and hundreds of thousands forced from their homes. Central African Republic Bush War (2004–2007) – began with the rebellion by the Union of Democratic Forces for Unity (UFDR) rebels, after the current president of the Central African Republic, François Bozizé, seized power in a 2003 coup. The violence has displaced around 10,000 civilians and has led to hundreds of civilians being killed."
2000s,"Civil war in Afghanistan (1996–2001) – an armed conflict that continued after the capture of Kabul by the Taliban, in which the formation of the Afghan Northern Alliance attempted to oust the Taliban. It proved largely unsuccessful, as the Taliban continued to make gains and eliminated much of the Alliance's leadership. 2000 overthrow of Slobodan Milošević in the Federal Republic of Yugoslavia – after Slobodan Milošević was accused by opposition figures of winning the 2000 election through electoral fraud, mass protests led by the opposition movement Otpor! pressure Slobodan Milošević to resign. Milošević was later arrested in 2001 and sent to the Hague to face war crimes charges for his alleged involvement in war crimes of the Yugoslav Wars. 2002 Venezuelan coup d'état attempt – a failed military coup d'état on April 11, 2002, which aimed to overthrow the president of Venezuela Hugo Chávez. During the coup Hugo Chávez was arrested and Pedro Carmona became the interim President for 47 hours. The coup led to a pro-Chávez uprising that the Metropolitan Police attempted to suppress. The pro-Chávez Presidential Guard eventually retook the Miraflores presidential palace without firing a shot, leading to the collapse of the Carmona government. 2004 Haitian coup d'état – a conflict fought for several weeks in Haiti during February 2004 that resulted in the premature end of President Jean-Bertrand Aristide's second term, and the installment of an interim government led by Gérard Latortue. 2006 Thai coup d'état – on September 19, 2006, while the elected Thai Prime Minister Thaksin Shinawatra was in New York for a meeting of the UN, Army Commander-in-Chief Lieutenant General Sonthi Boonyaratglin launched a bloodless coup d'état."
2000s,"Fatah–Hamas conflict (2006–2009) – an armed conflict fought between the two main Palestinian factions, Fatah and Hamas with each vying to assume political control of the Palestinian territories. In June 2007, Hamas took control of the entire Gaza Strip, and established a separate government while Fatah remained in control of the West Bank. This in practice divided the Palestinian Authority into two. Various forces affiliated with Fatah engaged in combat with Hamas, in numerous gun battles. Most Fatah leaders eventually escaped to Egypt and the West Bank, while some were captured and killed. 2009 Honduras coup d'état – The armed forces of the country entered the president's residence and overthrew president Manuel Zelaya. (see 2009 Honduran constitutional crisis). Since 2005, Iran's nuclear program has become the subject of contention with the Western world due to suspicions that Iran could divert the civilian nuclear technology to a weapons program. This has led the UN Security Council to impose sanctions against Iran on select companies linked to this program, thus furthering its economic isolation on the international scene. The U.S. Director of National Intelligence said in February 2009 that Iran would not realistically be able to a get a nuclear weapon until 2013, if it chose to develop one. In 2003, the United States invaded Iraq over allegations that its leader Saddam Hussein was stockpiling weapons of mass destruction including chemical and biological weapons or was in the process of creating them. None were found, spawning multiple theories. North Korea successfully performed two nuclear tests in 2006 and 2009. Operation Orchard – during the operation, Israel bombed what was believed to be a Syrian nuclear reactor on September 6, 2007, which was thought to be built with the aid of North Korea. The White House and Central Intelligence Agency (CIA) later declared that American intelligence indicated the site was a nuclear facility with a military purpose, though Syria denies this."
2000s,"The Doomsday Clock, the symbolic representation of the threat of nuclear annihilation, moved four minutes closer to midnight: two minutes in 2002 and two minutes in 2007 to 5 minutes to midnight. East Timor regains independence from Indonesia in 2002. Portugal granted independence to East Timor in 1975, but it was soon after invaded by Indonesia, which only recognized East Timorese independence in 2002. Montenegro gains independence from Serbia in 2006, ending the 88-year-old Yugoslavia. Kosovo declares independence from Serbia in 2008, though its independence still remains unrecognized by many countries. On August 23, 2005, Israel's unilateral disengagement from 25 Jewish settlements in the Gaza Strip and West Bank ends. On August 26, 2008, Russia formally recognises the disputed Georgian regions of Abkhazia and South Ossetia as independent states. The vast majority of United Nations member states maintain that the areas belong to Georgia. Paul Martin replaces Jean Chrétien as Prime Minister of Canada in 2003 by becoming the new leader of the Liberal Party. Stephen Harper was elected prime minister in 2006 following the defeat of Paul Martin's government in a motion of no confidence. Vicente Fox was elected President of Mexico in the 2000 presidential election, making him the first president elected from an opposition party in 71 years, defeating the then-dominant Institutional Revolutionary Party (PRI). Greenland was granted further Self-governance (or ""self-rule"") within the Kingdom of Denmark on June 21, 2009. George W. Bush was sworn in succeeding Bill Clinton as the 43rd President of the United States on January 20, 2001, following a sharply contested election. On October 26, 2001, U.S. President George W. Bush signed the USA PATRIOT Act into law. On June 5, 2004, Ronald Reagan, the 40th President of the United States, died after having suffered from Alzheimer's disease for nearly a decade. His seven-day state funeral followed, spanning June 5–11. The general public stood in long lines waiting for a turn to view the casket. People passed by the casket at a rate of about 5,000 per hour (83.3 per minute, or 1.4 per second) and the wait time was about three hours. In all, 104,684 passed through when Reagan lay in state."
2000s,"On May 18, 2000, Chen Shui-bian was elected as the president of Taiwan, ending the half-century rule of the KMT on the island, and became the first president of the DPP. Israeli withdrawal from the Israeli security zone in southern Lebanon – on May 25, 2000, Israel withdrew IDF forces from the Israeli occupation of southern Lebanon in southern Lebanon after 22 years. In July 2000 the Camp David 2000 Summit was held which was aimed at reaching a ""final status"" agreement between the Palestinians and the Israelis. The summit collapsed after Yasser Arafat would not accept a proposal drafted by American and Israeli negotiators. Barak was prepared to offer the entire Gaza Strip, a Palestinian capital in a part of East Jerusalem, 73% of the West Bank (excluding eastern Jerusalem) raising to 90–94% after 10–25 years, and financial reparations for Palestinian refugees for peace. Arafat turned down the offer without making a counter-offer. January 20, 2001 – June 30, 2010 – Gloria Macapagal Arroyo was the 14th president of the Republic of the Philippines. 2002 – Recep Tayyip Erdoğan was elected as Prime Minister of Turkey. Abdullah Gül was elected as President of Turkey. March 15–16, 2003 – CPC General Secretary, President Hu Jintao and Premier Wen Jiabao, replaced former People's Republic of China leaders Jiang Zemin and Zhu Rongji. 2003 – the 12-year self-government in Iraqi Kurdistan ends, developed under the protection of the UN ""No-fly zone"" during the now-ousted Saddam Hussein regime. 2003 – Prime minister of Malaysia Mahathir Muhammad resigns in October, he was succeeded by Abdullah bin Ahmad Badawi. Manmohan Singh was elected (2004) and reelected (2009) Prime Minister in India. He is the only Prime Minister since Jawaharlal Nehru to return to power after completing a full five-year term. Singh previously carried out economic reforms in India in 1991, during his tenure as the Finance Minister. January 4, 2006 – Powers are transferred from Israeli Prime Minister Ariel Sharon to his deputy, Vice Prime Minister Ehud Olmert, after Sharon suffers a massive hemorrhagic stroke."
2000s,"Parties broadly characterised by political scientists as being right-wing populist soar throughout the 2000s, in the wake of increasing anti-Islam and anti-immigration sentiment in most Western European countries.[84] By 2010, such parties (albeit often significant differences between them) were present in the national parliaments of Belgium, the Netherlands, Denmark, Norway, Sweden, Finland, Switzerland, Austria, Italy and Greece. In Austria, Italy and Switzerland, the Freedom Party of Austria, Lega Nord and Swiss People's Party, respectively, were at times also part of the national governments, and in Denmark, the Danish People's Party tolerated a right-liberal minority government from 2001 throughout the decade. While not being present in the national parliaments of France and the United Kingdom, Jean-Marie Le Pen of the National Front came second in the first round of the 2002 French presidential elections, and in the 2009 European Parliament election, the UK Independence Party came second, beating even the Labour Party, while the British National Party managed to win two seats for the first time. The 2000s experienced some of the worst and most destructive natural disasters in history. On January 13, 2001, a 7.6-magnitude earthquake strikes El Salvador, killing 944 people. On January 26, 2001, an earthquake hits Gujarat, India, killing more than 12,000. On February 28, 2001, the Nisqually earthquake hits the Seattle metro area. It caused major damage to the old highway standing in the urban center of Seattle. On February 13, 2001, a 6.6-magnitude earthquake hits El Salvador, killing at least 400. On May 21, 2003, an earthquake in the Boumerdès region of northern Algeria kills 2,200. On December 26, 2003, the massive 2003 Bam earthquake devastates southeastern Iran; over 40,000 people are reported killed in the city of Bam."
2000s,"On December 26, 2004, one of the worst natural disasters in recorded history hits southeast Asia, when the largest earthquake in 40 years hits the entire Indian Ocean region. The massive 9.3 magnitude earthquake, epicentered just off the west coast of the Indonesian island of Sumatra, generates enormous tsunami waves that crash into the coastal areas of a number of nations including Thailand, India, Sri Lanka, the Maldives, Malaysia, Myanmar, Bangladesh, and Indonesia. The official death toll from the Boxing Day tsunami in the affected countries with over 230,000 people dead. On October 8, 2005, the 2005 Kashmir earthquake kills about 80,000 people. On May 12, 2008, over 69,000 are killed in central south-west China by the Wenchuan quake, an earthquake measuring 7.9 on the moment magnitude scale. The epicenter was 90 kilometers (56 mi) west-northwest of the provincial capital Chengdu, Sichuan province. July 7–11, 2005 – Hurricane Dennis caused damage in the Caribbean and southeastern United States. Dennis killed a total of 88 people and caused $3.71 billion in damages. August 28–29, 2005 – Hurricane Katrina made landfall in Mississippi, devastating the city of New Orleans and nearby coastal areas. Katrina was recognized as the costliest natural disaster in the United States at the time, after causing a record $108 billion in damages (a record later surpassed by Hurricane Harvey in 2017). Katrina caused over 1,200 deaths. November 30, 2006 – Typhoon Durian (known in the Philippines as Typhoon Reming) affected the Philippines’ Bicol Region, and together with a concurrent eruption of Mayon Volcano, caused mudflows and killed more than 1,200 people. August 30, 2007 – Group of Croatian firefighters who were flown in on the island Kornat as part of the 2007 coast fires firefighting efforts perished. Twelve out of thirteen men who found themselves surrounded by fire were killed in the event which was the biggest loss of lives in the history of Croatian firefighting."
2000s,"May 3, 2008 – Cyclone Nargis had an extreme impact in Myanmar, causing nearly 140,000 deaths and $10 billion in damages. June 21, 2008 – Typhoon Fengshen passed over Visayas, Philippines, sinking the ship MV Princess of the Stars, and killing more than 800 passengers. February 7 – March 14, 2009 – The Black Saturday bushfires, the deadliest bushfires in Australian history, took place across the Australian state of Victoria during extreme bushfire-weather conditions, killing 173 people, injuring more than 500, and leaving around 7,500 homeless. The fires came after Melbourne recorded the highest-ever temperature (46.4 °C or 115.5 °F) of any capital city in Australia. The majority of the fires were caused by either fallen or clashing power lines, or arson. Winter of 2009–2010 – The winter of 2009–2010 saw abnormally cold temperatures in Europe, Asia, and America. A total of 21 people were reported to have died as a result of the cold in the British Isles. On December 26, 2009, Saint Petersburg, Russia, was covered by 35 cm of snow, the largest December snowfall recorded in the city since 1881. September 25–26, 2009 – Typhoon Ketsana (known in the Philippines as Tropical Storm Ondoy) caused flooding in the Philippines, mostly in the Manila Metropolitan area, killing nearly 700 people in total. Flooding levels reached a record of 20 ft (6.1 m) in rural areas. Antibiotic resistance is a serious and growing phenomenon in contemporary medicine and has emerged as one of the eminent public health concerns of the 21st century, particularly as it pertains to pathogenic organisms (the term is not especially relevant to organisms which don't cause disease in humans)."
2000s,"The outbreak of foot-and-mouth disease in the United Kingdom in 2001 caused a crisis in British agriculture and tourism. This epizootic saw 2,000 cases of the disease in farms across most of the British countryside. Over 10 million sheep and cattle were killed. Between November 2002 and July 2003, an outbreak of severe acute respiratory syndrome (SARS) occurred in Hong Kong, with 8,273 cases and 775 deaths worldwide (9.6% fatality) according to the World Health Organization (WHO). Within weeks, SARS spread from Hong Kong to infect individuals in 37 countries in early 2003. Methicillin-resistant Staphylococcus aureus: the Office for National Statistics reported 1,629 MRSA-related deaths in England and Wales during 2005, indicating a MRSA-related mortality rate half the rate of that in the United States for 2005, even though the figures from the British source were explained to be high because of ""improved levels of reporting, possibly brought about by the continued high public profile of the disease"" during the time of the 2005 United Kingdom General Election. MRSA is thought to have caused 1,652 deaths in 2006 in UK up from 51 in 1993. The 2009 H1N1 (swine flu) flu pandemic was also considered a natural disaster. On October 25, 2009, U.S. President Barack Obama officially declared H1N1 a national emergency.[98] Despite President Obama's concern, a Fairleigh Dickinson University PublicMind poll found in October 2009 that an overwhelming majority of New Jerseyans (74%) were not very worried or not at all worried about contracting the H1N1 flu virus. A study conducted in coordination with the University of Michigan Health Service is scheduled for publication in the December 2009 American Journal of Roentgenology warning that H1N1 flu can cause pulmonary embolism, surmised as a leading cause of death in this current pandemic. "
2000s,"The study authors suggest physician evaluation via contrast enhanced CT scans for the presence of pulmonary emboli when caring for patients diagnosed with respiratory complications from a ""severe"" case of the H1N1 flu. As of May 30, 2010, as stated by the World Health Organization, more than 214 countries and overseas territories or communities have reported laboratory confirmed cases of pandemic influenza H1N1 2009, including over 18,138 deaths. The Walkerton Tragedy is a series of events that accompanied the contamination of the water supply of Walkerton, Ontario, Canada, by Escherichia coli bacteria in May 2000. Starting May 11, 2000, many residents of the community of about 5,000 people began to simultaneously experience bloody diarrhea, gastrointestinal infections and other symptoms of E. coli infection. Seven people died directly from drinking the E. coli contaminated water, who might have been saved if the Walkerton Public Utilities Commission had admitted to contaminated water sooner, and about 2,500 became ill. In 2001 a similar outbreak in North Battleford, Saskatchewan caused by the protozoan Cryptosporidium affected at least 5,800 people. On January 31, 2000, Alaska Airlines Flight 261 crashed into the Pacific Ocean off the coast of California after the plane's jackscrew failed, killing all 88 on board. On July 25, 2000, Air France Flight 4590, a Concorde aircraft, crashed into a hotel in Gonesse just after takeoff from Paris, killing all 109 aboard and 4 in the hotel. This was the only Concorde accident in which fatalities occurred. It was the beginning of the end for Concorde as an airliner; the type was retired three years later. On August 12, 2000, the Russian submarine K-141 Kursk sank in the Barents Sea, killing all 118 men on board. On November 11, 2000, the Kaprun disaster occurred. 155 people perished in a fire that broke out on a train in the Austrian Alps."
