HEATWAVE,"Heatwaves are most common in summer when high pressure develops across an area. High pressure systems are slow moving and can persist over an area for a prolonged period of time, such as days or weeks. They can occur in the UK due to the location of the jet stream, which is usually to the north of the UK in the summer. This can allow high pressure to develop over the UK resulting in persistent dry and settled weather. Summer 2018 was the equal-second warmest summer in a UK series from 1884 for mean daily maximum temperature (shared with 1995) with summer 1976 hottest. Heatwaves are extreme weather events, but research shows that climate change is making these events more likely. A scientific study by the Met Office into the Summer 2018 heatwave in the UK showed that the likelihood of the UK experiencing a summer as hot or hotter than 2018 is a little over 1 in 10. It is 30 times more likely to occur now than before the industrial revolution because of the higher concentration of carbon dioxide (a greenhouse gas) in the atmosphere. As greenhouse gas concentrations increase heatwaves of similar intensity are projected to become even more frequent, perhaps occurring as regularly as every other year by the 2050s. The Earth’s surface temperature has risen by 1 °C since the pre-industrial period (1850-1900) and UK temperatures have risen by a similar amount. The UK experiences occasional heatwaves but of a lesser frequency and intensity of those seen elsewhere globally. The summer of 2018 was the equal-warmest summer for mean temperatures in the UK along with 2006, 2003 and 1976. The hottest day of the summer was on 27 July, with 35.6 °C recorded at Felsham, Suffolk. In August 2003, the UK experienced heatwave conditions lasting 10 days and resulting in 2,000 deaths. During this heatwave, a record maximum temperature of 38.5 °C was recorded at Faversham in Kent. In July 2006, similar conditions occurred breaking records and resulting in the warmest month on record in the UK. In the summer of 2019, the 2003 maximum temperature record was broken at Cambridge University Botanic Garden on 25 July, with 38.7 °C. "
HEATWAVE,"To aid in the preparation and awareness before and during a spell of very hot weather, a heatwave plan has been created by UK Health Security Agency in association with the Met Office and other partners. It recommends a series of steps to reduce the risks to health from prolonged exposure to severe heat for: The NHS, local authorities, social care, and other public agencies. Professionals working with people at risk. Individuals, local communities and voluntary groups. Find out more about staying prepared for summer weather on our WeatherReady advice page, there are also some practical steps you can take to keep homes cool during the day. Extreme Heat Warning – an impact-based warning designed to highlight the potential impacts of extreme heat to protect lives and property, helping people make better decisions to stay safe and thrive. UK Health Security Agency (UKHSA) Heat Health Alert - An England only service considering the impact of prolonged extreme heat on public health, especially those with long-term health conditions. Heatwave definition - a threshold-based meteorological definition designed to provide the media and public with consistent and reliable messaging. A heat wave is an extended period of unusually high temperatures and often high humidity. They are expected to become more frequent and more severe in future due to climate change. People affected by heat waves can suffer from shock, become dehydrated and develop serious heat illnesses. Heat waves can also worsen chronic cardiovascular and respiratory diseases. Learn about the risks and potential impacts of extreme heat in your area and find information on local and regional communication channels for early warning of very hot days. Look for shade facilities and work with your community to identify places for people to cool off during heat and power outages. And stay informed: monitor the weather closely to see if extreme hot weather conditions, a heat wave watch or warning is expected."
HEATWAVE,"Data from the Copernicus Climate Change Service (C3S) show how unusually intense and widespread the heatwaves across Europe this summer have been. Together with prolonged dry periods, they have contributed to higher-than-average wildfire activity and severe droughts; and several countries have reported thousands of additional deaths. Perhaps surprisingly, there is no standard definition of a heatwave. The World Meteorological Organization suggests a heatwave is ‘statistically unusual hot weather persisting for a number of days and nights’, but countries adapt this guideline based on the impact on the local population. For example, high humidity and low wind speeds exacerbate heat stress on humans. In addition, the number of days a heatwave lasts, overnight temperatures and number of additional deaths are also important factors to consider. Therefore, although a heatwave is a meteorological event, human impacts are key. The consequences of the heatwaves of 2022 have affected hundreds of millions of people, with implications for health and wellbeing, agriculture and food supplies, energy prices and demand, natural ecosystems, and river, air, rail and road transport. Each episode has been striking; either because of the extreme temperatures reached locally, their duration, and/or unusually early occurrence in the season. Many local, national and regional temperature records were broken, or came close to being broken. Although exceptional, these events were not unexpected. They are in line with the evidence presented in the latest IPCC Assessment Report, which indicates that the frequency and intensity of heatwaves continues to increase. These changes are attributed to human-induced climate change with high confidence and are expected to last, or maybe even amplify, as the climate warms globally. Daily maximum temperatures in Spain, France, and Italy reached above 40°C, exacerbating the ongoing drought conditions in the Po river basin. Numerous June temperature records were broken across France and Spain."
HEATWAVE,"The first signs of unusually warm weather in Europe appeared during May, when hotter-than-average air from the western Sahara moved northwards pushing the temperature up in waves in several areas of southwestern Europe, including Portugal, Spain, southern France and parts of western Italy. At a national level, May 2022 temperatures set many new records, starting with France, where it was the warmest May since records began in 1900. It was the warmest May in 92 years of records for Portugal, and only May 1964 was warmer for Spain, in a data record starting in 1961, according to the analyses of the respective national meteorological services. Many local records were also broken. The Spanish city of Seville reached 41°C, a first for the month, and Jaén experienced both its hottest day in May and the highest daily minimum temperature ever recorded in May in mainland Spain. Portugal reported a heatwave in the first half of the month and a ‘heat burst’, an exceptional sudden rise in temperatures, later in the month. This relatively rare phenomenon was seen also in southern France in mid-May. At a regional scale, the C3S ERA5 reanalysis, in a database going back to 1967, shows that in 2022 southwestern Europe [1] recorded the highest average May daily maximum temperatures, ahead of 2015, 2020 and 2017. The minimum daily average temperatures were also the highest; slightly higher than in May 2020 and 1999. Heatwaves continued to take place over several regions of Europe during June. These events left a mark on the monthly average temperatures: the month as a whole was, jointly with 2021, the second warmest June on record for Europe. Southwestern Europe, including parts of Spain, Italy and France, continued to experience long spells of exceptionally high temperatures. Following the shorter period of unusually warm temperatures that peaked on 21 May, a longer episode of exceptionally high temperatures occurred four weeks later, peaking on 17 June. Average temperatures then fell rapidly in the region, although heatwave conditions developed further to the east and north."
HEATWAVE,"Europe continued to experience unusually warm temperatures in July, with an intense and prolonged heatwave that started in Spain and Portugal before spreading further north and east, towards France, the United Kingdom, central Europe and Scandinavia. Dry conditions also continued throughout July, exacerbated by the heat. As a result, some countries saw record high temperatures and recorded their driest July ever. In mid-July, an area of high pressure settled over western Europe. Combined with hot air flow from North Africa ahead of a trough moving northeastwards from west of Portugal, this led to more heatwaves which affected the majority of western Europe. Temperatures reached more than 40°C for at least one day in Spain, France and the United Kingdom. In particular, the UK saw a national daily maximum temperature record of 40.3°C, set at Coningsby in Lincolnshire on 19 July – the first time the country had ever recorded a temperature of over 40°C. The observation network data indicate that the previous UK temperature record of 38.7°C (recorded in July 2019) was met or exceeded at 46 stations across the country. In general, western Europe saw a larger number of days with temperatures above 35°C and 40°C than a typical July. While the heatwave daily temperatures were extreme, in some regions reaching local and national records, it was mainly the duration of the period with daily maximum temperatures between 35°C and 40°C that characterised July; particularly in southwestern Europe. The number of days above 30°C was also well above average, but, as with the number of days above 35°C, generally not record-breaking. The low number of days above 35°C in southeastern Europe is also noteworthy, again indicating that the heat mainly affected the southwest. July 2022 was the warmest on record in southwestern Europe in terms of average maximum temperatures. Average minimum temperatures were also among the top three warmest Julys."
HEATWAVE,"As the summer drew to a close, temperatures for August were higher than average across most of Europe. The far east of the continent saw the most-above-average temperatures, but southwestern regions were still much warmer than average. Temperatures were also generally high in the western regions, but lower than the extremes experienced earlier in the summer, or in August 2003 and 2021. More detail about surface air temperatures across Europe and the rest of the world can be found in the C3S monthly Climate Bulletins. Monthly, seasonal, and yearly data are freely available in the C3S Climate Data Store (CDS). Find out more about C3S reanalyses and ERA5 in the reanalysis Q&A. Working with key climate-sensitive sectors, C3S has developed applications, based on quality-assured and freely accessible data, to support public and private sectors in their climate-sensitive decisions. For example, due to artificial infrastructure and human activities, urban areas are often significantly warmer than their rural surroundings. These higher temperatures can negatively impact human health. Using C3S ERA5 climate reanalysis data on air temperature, specific humidity, relative humidity and wind speed, the demonstrator application set up by VITO reports on urban heat island intensity for 100 European cities from 2008 to 2017 at a high spatial resolution of 100 metres. The application shows locations at risk of urban heat stress and enables users to visualise the spatial distribution of cool spots in a city. This information can be used by urban planners, for example, to develop a network of accessible cool spots that are promoted during heatwaves. It can also support the implementation of local adaptations, such as the requirement for green roofs in building codes. The impact on the population of hot, and cold, weather, can be visualised using another application – the Thermal Assessment Tool. This will support public health and urban planning managers, climate change researchers, and other stakeholders to visualise past and future climate trends and make appropriate decisions. C3S is implemented by the European Centre for Medium-Range Weather Forecasts on behalf of the European Commission."
HEATWAVE,"For some, a heat wave might sound like an excuse to run around with a hose or into some sprinklers. In reality, though, heat waves are no laughing matter. They are serious weather phenomena that can be quite dangerous. You see, there’s hot and then there’s HOT. One example of a HOT time was in late June and early July 2012 in the United States. During that time period, more than 8,000 warm temperature records were broken or tied. Many of these records had been unchallenged since the 1930s. Roads actually buckled in Chicago. Many deaths were attributed to the heat nationwide. Heat waves are generally the result of trapped air. During the 2012 heat wave, air was trapped above much of North America for a long period of time. As opposed to cycling around the globe, it simply stayed put and warmed like the air inside an oven. The culprit? A high-pressure system from Mexico. Between June 20th and June 23rd, this system migrated north. It grew in size, and it parked itself over the Great Plains of the United States. High-pressure systems force air downward. This force prevents air near the ground from rising. The sinking air acts like a cap. It traps warm ground air in place. Without rising air, there was no rain, and nothing to prevent the hot air from getting hotter. But that wasn’t all. A weather pattern that normally pulls air toward the east was also weaker at the time. That meant that there was little that could be done to push this high-pressure cap out of the way. Heat waves like this may be less exciting or dramatic than other natural disasters like tornados, hurricanes, flooding, or even thunderstorms, but heat waves kill more people in the United States than all other weather-related disasters combined. Check out the sidebar to learn more about what you can do to stay safe!"
HEATWAVE,"Heat wave, also called heatwave, period of prolonged abnormally high surface temperatures relative to those normally expected. Heat waves may span several days to several weeks and are significant causes of weather-related mortality, affecting developed and developing countries alike. Globally, the increasing frequency and intensity of heat waves observed since the 1950s has been associated with climate change. Such weather phenomena may be characterized by low humidity, which may exacerbate drought, or high humidity, which may exacerbate the health effects of heat-related stress, which include heat exhaustion, dehydration, and heatstroke. No formal, standardized definition of a heat wave exists. The World Meteorological Organization defines it as five or more consecutive days during which the daily maximum temperature surpasses the average maximum temperature by 5 °C (9 °F) or more. Some countries have adopted their own standards. For example, the India Meteorological Department requires that temperatures increase 5–6 °C (9–10.8 °F) or more above the normal temperature, whereas the U.S. National Weather Service defines a heat wave as a spell of “abnormally and uncomfortably hot and unusually humid weather” spanning two days or more. Oppressively hot and humid air masses lingering over populated areas can produce many deaths, especially in the middle latitudes, where many people—including the very young, the very old, and those with health problems—may be more susceptible to heat stress. Notable modern episodes include the Russian heat wave of 2010 (which covered 1,036,000 square km [400,000 square miles] and killed 55,000 people), the European heat wave of 2003 (in which more than 30,000 people died), the U.S. heat wave and drought of 1988 (which killed more than 4,000 people), and the Indian heat wave of 2015 (which killed more than 2,500 people)."
HEATWAVE,"Across the globe, hot days are getting hotter and more frequent, while we’re experiencing fewer cold days. Over the past decade, daily record high temperatures have occurred twice as often as record lows across the continental United States, up from a near 1:1 ratio in the 1950s. Heat waves are becoming more common, and intense heat waves are more frequent in the U.S. West, although in some parts of the country the 1930s still holds the record for number of heat waves (primarily related to the Dust Bowl, which was exacerbated by the conversion of prairie to farmland). If greenhouse gas emissions are not significantly curtailed, daily high and low temperatures will increase by at least 5 degrees F in most areas by mid-century, rising to 10 degrees F by late century. The National Climate Assessment estimates 20-30 more days over 90 degrees F in most areas by mid-century. Heat waves are more dangerous when combined with high humidity. The combination of temperature and humidity is measured by the heat index. A recent study projects that the annual number of days with a heat index above 100 degrees F will double, and days with a heat index above 105 degrees F will triple, nationwide, when compared to the end of the 20th century. Extreme heat can increase the risk of other types of disasters. Heat can exacerbate drought, and hot, dry conditions can in turn create wildfire conditions. Buildings, roads, and infrastructure absorb heat, leading to temperatures that can be 1 to 7 degrees F hotter in urban areas than outlying areas – a phenomenon known as the urban heat island effect. This impact is most intense during the day, but the slow release of heat from the infrastructure (or an atmospheric heat island) overnight can keep cities much hotter than surrounding areas. Rising temperatures across the country pose a threat to people, ecosystems, and the economy."
HEATWAVE,"Extreme heat is one of the leading causes of weather-related deaths in the United States, killing an average of more than 600 people per year from 1999-2009, more than all other impacts (except hurricanes) combined. The Billion Dollar Weather Disasters database compiled by the National Oceanic and Atmospheric Administration lists heat waves as six of the top 10 deadliest U.S. disasters since 1980. Heat stress occurs in humans when the body is unable to cool itself effectively. Normally, the body can cool itself through sweating, but when humidity is high, sweat will not evaporate as quickly, potentially leading to heat stroke. High humidity and elevated nighttime temperatures are likely key ingredients in causing heat-related illness and mortality. When there’s no break from the heat at night, it can cause discomfort and lead to health problems, especially for those who lack access to cooling, which are often people who have low incomes. Other groups that are particularly vulnerable to heat stress include older adults, infants and children, people with chronic health conditions, and outdoor workers. Hot days are also associated with increases in heat-related illnesses, including cardiovascular and respiratory complications and kidney disease. In extreme temperatures, air quality is also affected. Hot and sunny days can increase the production of ground-level ozone, a harmful pollutant that is the main component of smog, which can damage the respiratory system and is particularly harmful for those with asthma. In addition, greater use of air conditioning requires more electricity which, depending on the electricity source, emits other types of pollution, including particulates that have an impact on air quality too. These increases in ozone and particulate matter can pose serious risks to people, particularly the same vulnerable groups directly impacted by heat mentioned above."
HEATWAVE,"High temperatures can be damaging to agriculture. Plant growth is negatively impacted by high daytime temperatures and some crops require cool night temperatures. Heat waves also increase the chances of livestock experiencing heat stress, especially when night time temperatures remain high and animals are unable to cool off. Heat-stressed cattle can experience declines in milk production, slower growth, and reduced conception rates. Heat waves can exacerbate droughts and wildfires, which can lead to negative impacts on the agriculture sector. For example, the 2021 drought in the West caused North Dakota cattle ranchers to sell their stock due to a lack of feed for the winter. Wildfires in California have burned agricultural land and are raising the cost of insurance for farms and wineries. Warmer temperatures affect many aspects of the U.S. energy system, including production, transmission, and demand. While higher summer temperatures increase electricity demand for cooling, at the same time, they can lower the ability of transmission lines to carry power, possibly leading to electricity reliability issues like rolling blackouts during heat waves. Although warmer winters will reduce the need for heating, modeling suggests that total U.S. energy use will increase in a warmer future. In addition, as rivers and lakes warm, their capacity for absorbing waste heat from power plants declines. This can reduce the thermal efficiency of power production, which makes it difficult for power plants to comply with environmental regulations regarding the temperature of their cooling water, and could lead to plant shut-downs. Strategies to build resilience to extreme heat are laid out in our publication, “Resilience Strategies for Extreme Heat.” Some strategies include: Identifying vulnerable populations and creating heat preparedness plans with all residents in mind, that may include steps like opening cooling centers during periods of extreme heat and adopting workplace heat stress standards. Installing cool and green roofs and cool pavement to reduce the urban heat island effect. Planting trees to provide shade and to cool the air through evapotranspiration. Pursuing energy efficiency to reduce demand on the electricity grid, especially during heat waves."
HEATWAVE,"Summertime means hot weather — sometimes dangerously hot — and extreme heat waves have become more frequent in recent decades. Sometimes, the scorching heat is ensnared in what is called a heat dome. This happens when strong, high-pressure atmospheric conditions combine with influences from La Niña, creating vast areas of sweltering heat that gets trapped under the high-pressure ""dome."" A team of scientists funded by the NOAA MAPP Program investigated what triggers heat domes and found the main cause was a strong change (or gradient) in ocean temperatures from west to east in the tropical Pacific Ocean during the preceding winter. Imagine a swimming pool when the heater is turned on — temperatures rise quickly in the areas surrounding the heater jets, while the rest of the pool takes longer to warm up. If one thinks of the Pacific as a very large pool, the western Pacific’s temperatures have risen over the past few decades as compared to the eastern Pacific, creating a strong temperature gradient, or pressure differences that drive wind, across the entire ocean in winter. In a process known as convection, the gradient causes more warm air, heated by the ocean surface, to rise over the western Pacific, and decreases convection over the central and eastern Pacific. As prevailing winds move the hot air east, the northern shifts of the jet stream trap the air and move it toward land, where it sinks, resulting in heat waves. A heat dome occurs when the atmosphere traps hot ocean air like a lid or cap. Studies found an increase in the Pacific Ocean's temperature gradient due to global warming, which suggests the future potential for even more frequent heat waves. This type of research improves scientists' ecoforecasting capabilities. During this year we have seen some unprecedented high temperatures around the world. To some they come as a welcome chance to relax in a local park, while enjoying a refreshingly cool beverage or ice lolly. To others, they bring a host of unprecedented economic, social and health risks and challenges."
