DROUGHTS,"Global Precipitation Management (GPM), a joint satellite mission between NASA and the Japanese Aerospace Exploration Agency (JAXA), provides global precipitation data every three hours. Used in conjunction with other weather data and forecasting efforts, GPM data helps quantify when, where, and how much it rains or snows around the world. The NASA Soil Moisture Active Passive (SMAP) global observatory measures the amount of liquid water in the top 5 cm of the soil using a microwave-based radar. The effects of low soil moisture on vegetation is apparent in satellite imagery from the Moderate Resolution Imaging Spectroradiometer (MODIS) instrument on NASA’s Terra and Aqua satellites, and from the joint NASA and United States Geological Survey (USGS) Landsat satellites. When used together these observations give a comprehensive view of water availability and water use, as well as actual soil moisture conditions in the soil - where farmers grow food. The Jason-3 satellite – a four-agency international partnership of the National Oceanic and Atmospheric Administration (NOAA), NASA, the French Space Agency CNES (Centre National d'Etudes Spatiales), and EUMETSAT (the European Organization for the Exploitation of Meteorological Satellites) – provides information about the height of rivers and reservoirs, allowing scientists to estimate how much water they contain. The Gravity Recovery and Climate Experiment Follow-On (GRACE-FO) mission, a partnership between NASA and the German Research Centre for Geosciences (GFZ), estimates groundwater using a pair of satellites. The satellites fly in tandem about 137 miles apart and use microwaves to measure the distance between them. When one satellite passes over an area with stronger gravity – such as a spot with lots of groundwater and thus more mass – the satellite in the lead is pulled further ahead. By analyzing the distance between the satellites, scientists can track where water is on our planet. NASA’s upcoming Earth System Observatory, together with other planned NASA missions that are part of NASA’s “program of record” will continue many these observations in the future to provide key information that will guide decision-makers confronting challenges posed by climate change, such as drought. Much of this data is incorporated into drought maps and global groundwater maps produced and distributed by the National Drought Mitigation Center at the University of Nebraska-Lincoln."
DROUGHTS,"“What we’re able to do is bring in all of this data and use the best attributes of those tools,” said Brian Fuchs, a climatologist at the National Drought Mitigation Center. Frequent satellite observations allow Fuchs and his colleagues to track rapidly changing drought conditions. The satellites’ view from space also provides routine, country-wide and world-wide snapshots of drought that can be accessed by local water managers. “We’re not experts in every part of the country, but we have people on the ground who know their backyards better than we do,” said Fuchs. Schohr is one of those people. She uses the U.S. Drought Monitor maps, which provide a weekly assessment of drought conditions, to check the state of drought around the country and look at trends to help her make better decisions for the future. She is also one of the many ranchers across the country who sends updates and photos to the scientists at Drought Monitor to help refine their maps. “That boots on the ground validation really helps us get a good local perspective on what the challenges are,” said Fuchs. Every year in early November, Schohr and her family load their cows into cattle trailers and drive them to annual grasslands about 35 miles away. While there, the herd rotates through several pastures, searching for grass and water. This protects the land from overgrazing, ensuring that the cows have enough to eat and that healthy grasses will regrow in time for the next. “We have to have grass to grow grass,” Schohr explains. “And what’s best for the land is also what’s best for our cattle operation.” During a drought, nutritional supplements and access to reliable water are essential. Here a cow and her calf eat out of a protein supplement tub on California annual grasslands. Credit: Courtesy of Tracy Schohr. With little rain last fall, the Schohrs opted to keep the cattle at their home ranch where the family could easily check on them. Schohr brought hay out to the pasture and checked the water levels in the naturally occurring streams and ponds every few days. She also gave the cows tubs of nutritional supplements, which she says is like a combination multivitamin and protein shake that’s sweetened with molasses. The Schohrs eventually moved their herd to the annual grasslands in mid-December. The cattle grazed in several pastures last winter, including a purple needle grass restoration site that is part of a research project to restore native species. The cows munch on invasive and non-native grasses, weeding out the competition for the native California purple needle grass that will grow in the spring."
DROUGHTS,"As the cows mow down grass, Schohr is also checking that they have access to enough water. Cows need to drink between eight and 15 gallons of water per day. The annual grasslands don’t have much natural drinking water—especially this year, as reservoirs are depleted and streamflow is abnormally low, conditions signifying a hydrological drought, which California is currently experiencing. In winter, Schohr relies on solar-powered wells to keep her cattle hydrated. In the spring, she moves the cows to a pasture with seasonal ponds that are home to many California plant species and provide the cows with natural drinking water. Later in the season, the cows move to a field filled with oak trees. The trees provide shade to keep the cattle cool as spring turns to summer, and the cattle mow down the grass so there’s less kindling in the form of dry grass come fire season. The herd will usually stay on these annual grasslands until mid-June, but this year Schohr brought the cattle home in mid-May. California was not only dealing with low reservoirs and streams, but also low soil moisture, called agricultural drought, that causes plants—including that all important grass—to die. As green vegetation started to turn into swaths of brown, Schohr irrigated the pasture on her home ranch on April 1 to keep the grass alive so that the cows would have food to eat when they returned. However, the natural food supply will only last so long. The current outlook suggests California will be in a severe drought at least through the fall, so Schohr is selling calves and stocking her barn with hay, corn and soybean stock in preparation. The challenges of drought that Schohr faces today are the same ones her grandfather dealt with. However, she says it’s easier to make better decisions and prepare for the future with the scientific data that’s available from sources like the U.S. Drought Monitor. The Schohr family had to make a lot of tough decisions during the 1980s farm crisis, when farmers’ debt soared due to an economic recession, and the intense California drought in the 1990s. At one point, the family sold all the cows to instead focus on growing rice. After that, Schohr recalls her grandfather was always the first one there when a new calf was born or a cow was sick. Her grandfather has since passed away, but Schohr remembers the lessons he taught her. She recalls riding on an ATV with him to check the water level in the troughs during a drought, listening to him talk about water management and seeing the sense of peace that came over him from watching the cattle grazing. “He loved the cows just like I do,” she said. “He believed that if he took care of the land, it would take care of him too.”"
DROUGHTS,"Climate science tells us that the world will be warmer and droughts are likely to be more frequent in the future. In addition, climate science models provide a better sense of what the future may hold, helping farmers, ranchers and water managers to make better decisions in preparation. However, it’s impossible to pinpoint exactly when and where droughts will occur in the future or predict how severe their impacts will be. But we do know that in certain regions, the fingerprint of human influence on drought is already visible. Human activities emit carbon dioxide and other greenhouse gases that warm the planet. A warmer planet is a thirstier planet, because warmer air drives more evaporation of water vapor from the surface,” explains Kate Marvel, a research scientist at NASA GISS. As the climate changes on Earth, some places will become drier – and thus more prone to drought – while others become wetter and thus more susceptible to flooding. If we continue emitting greenhouse gases, this trend is likely to continue. NASA’s climate models and others show that – under high emission scenarios – droughts could become much worse across the U.S. and globally. Drought-prone areas could enter persistent megadroughts, precipitation patterns and snowmelt could change drastically, the risk of dry soils could increase in many areas and some places could see more frequent and severe wildfires. “The worst-case scenarios don’t have to come true. It’s not a prediction,” Marvel said. To prevent those worst-case scenarios from happening, greenhouse gas emissions will need to be reduced, she said. “That’s the main determinant of drought risk in the future.” The Po, Italy’s longest river, has been a vital transport hub throughout history helping the north of the country develop into an industrial powerhouse. But “the king of rivers” is now drying up because of periods of severe drought. Experts say it is almost three metres below the zero gauge height, significantly below the seasonal average. The Italian government declared a state of emergency in five regions in early July because of a drought - described as the worst in 70 years. Around a third of Italy’s population (17 million people), live around the Po as well as more than half of the nation’s pigs and cattle. The drought has threatened supplies of olive oil and risotto rice which could raise prices by as much as 50%, reports The Guardian. “There are two categories of causes for this water crisis: One is the rainfall deficit of the last three years. The general rise in temperatures is also contributing; there is no doubt that climate change is having an effect,” Italy’s Prime Minister Mario Draghi said in a statement."
DROUGHTS,"Neighbouring France is experiencing its worst drought since records began in 1958, according to Prime Minister Elisabeth Borne. Water restrictions are in place across much of the country, and the corn harvest is expected to be almost 20% lower than 2021 the Agriculture Ministry has said. Portugal recorded its hottest July since records began and 99% of the country is in severe or extreme drought. Average temperatures were just over 40°C, according to the IPMA weather service, almost three degrees higher than the typical July average. Around 75% of Romania is affected by drought. The country’s cereal crop is predicted to drop by 30 million tonnes. Even further North, drought has been declared in parts of England, which is expected to result in restrictions on water usage. The National Drought Group says by 2050 some rivers could have up to 80% less water during summer and temperatures could be up to 7 degrees hotter as a result of climate change. July saw temperatures in parts of the UK break the 40°C barrier for the first time ever. The BBC reported that the first six months of the year were the driest in England since 1976. The Horn of Africa is experiencing its worst drought in more than 40 years with more than 18 million people facing severe hunger in Ethiopia, Somalia and parts of Kenya, the FAO has warned. The United Nations (UN) says drought affects Africa more than any other continent, accounting for 44% of the global total in its recent report Drowning by Numbers. These countries have experienced lower than average rainfall for four consecutive years, which has had a devastating effect on farming and food production. The FAO has launched an emergency relief and mitigation plan and the UN’s refugee agency UNHCR is appealing for $42.6 million to deliver life-saving assistance to people affected by drought in the region. More than 43% of the US was in drought at the end of July, the government’s National Integrated Drought Information System revealed. It says over 130 million people [at the time of posting] are currently affected by drought, as well as 229 million acres of crops. The US economy has lost an estimated £249 million due to drought and related crop failures according to the UN."
DROUGHTS,"Drought frequency and duration has increased by nearly a third globally since 2000, the UN says. The climate crisis is fuelling this according to Drought in Numbers, 2022. It says more than 2.3 billion people around the world are currently facing water stress. Although droughts only represent 15% of natural disasters, they killed 650,000 people between 1970 and 2019. More than 10 million have died due to major drought events over the past 100 years. The report goes on to say that by 2050, drought could affect more than 75% of the world’s population. As many as 5.7 billion people could live in areas with water shortages for at least one month a year, and more than 215 million people could be displaced from their homes due to drought and other climate change-related factors. “We are at a crossroads,” said Ibrahim Thiaw, Executive Secretary of the UN Convention to Combat Desertification says in the foreword to the report. “We need to steer toward the solutions rather than continuing with destructive actions, believing that marginal change can heal systemic failure.” He also said in a tweet that land restoration is one solution to the problem that needs urgent investment. However, the report also points to several success stories. Farmers in Niger have substantially reduced drought risks by creating new agroforestry systems on five million hectares of land. Average costs have been below $20 per hectare. Vegetation cover has increased over seven million hectares of land in the Sahel over the past 25 years due to interventions such as changes in tree management and tenure. And the adoption of drip irrigation has provided significant benefits in drought-prone provinces of Viet Nam, Cambodia, and Indonesia. Vegetable farmers there were able to increase water use efficiency by up to 43% and yield by 8%-15%. The Drought in Numbers 2022 report concludes: “Sustainable and efficient agricultural management techniques are needed to grow more food on less land and with less water, and humans must change their relationships with food, fodder and fibre – moving toward plant-based diets and stemming the consumption of animals.” The report authors say concerted policy, partnerships and funding at all levels is urgently needed going forward to provide integrated drought action plans. To gauge the influence of global warming on droughts and other extreme weather events, scientists use computer simulations to examine both the real-world climate and an alternate climate in which humans hadn’t burned fossil fuels and emitted greenhouse gases for more than a century. They see how often weather events as severe as the one in question occur in both worlds. The differences suggest how much global warming was to blame. Scientists with World Weather Attribution found last month that climate change had quite likely worsened this summer’s devastating floods in Pakistan, which have killed 1,600 people, damaged two million homes and submerged large stretches of farmland. Earlier, they found that global warming had made Britain’s record-shattering July heat wave both hotter and more likely to occur."
DROUGHTS,"Human-caused global warming has made severe droughts like the ones this summer in Europe, North America and China at least 20 times as likely to occur as they would have been more than a century ago, scientists said Wednesday. It’s the latest evidence of how climate change caused by the burning of fossil fuels is imperiling food, water and electricity supplies around the world. The main driver of this year’s droughts was searing heat throughout much of the Northern Hemisphere, the researchers reported in a new study. Such high average temperatures, over such a large area, would have been “virtually impossible” without the influence of greenhouse gas emissions, the scientists said. Across the Northern Hemisphere north of the tropics, soil conditions as parched as they were this summer now have a roughly 1-in-20 chance of occurring each year, the scientists found. Global warming increased this likelihood, they said, but cautioned that because of the challenges involved in estimating soil moisture at a global scale, the exact size of the increase had a wide possible range. “In many of these countries and regions, we are clearly, according to the science, already seeing the fingerprints of climate change,” said Maarten van Aalst, the director of the Red Cross Red Crescent Climate Center and one of 21 researchers who prepared the new study as part of the World Weather Attribution initiative, a research collaboration that specializes in rapid analysis of extreme weather events. “The impacts are now very clear to people, and they’re hitting hard,” Dr. van Aalst said. Extreme summer dryness that ravages crops, cripples river commerce and strains hydropower generation across so much of the planet would be hugely problematic on its own. This year, though, global food and energy prices had already been rising for other reasons, including Russia’s war in Ukraine. Record heat began smothering Europe in May, and roasting temperatures dried out rivers and fueled wildfires for prolonged stretches over the next few months. The heat might have contributed to 11,000 excess deaths in France and 8,000 in Germany, according to estimates. Across the European Union, summer wildfires burned a total area more than twice as large as the average over the previous 15 years. China had its most brutal summer since modern records began in 1961, according to the country’s meteorological authority, with hot and dry weather reducing hydropower output in the manufacturing-heavy south. To keep production lines running at car and electronics factories, China dug up and burned more coal, increasing its contribution to global warming. And in the United States, nearly half of the area of the lower 48 states experienced moderate to extreme drought this summer, according to the National Oceanic and Atmospheric Administration. Parts of the Southwest and California remain stuck in a 20-year-plus megadrought."
EARTHQUAKES,"An earthquake (also known as a quake, tremor or temblor) is the shaking of the surface of the Earth resulting from a sudden release of energy in the Earth's lithosphere that creates seismic waves. Earthquakes can range in intensity, from those that are so weak that they cannot be felt, to those violent enough to propel objects and people into the air, damage critical infrastructure, and wreak destruction across entire cities. The seismic activity of an area is the frequency, type, and size of earthquakes experienced over a particular time period. The seismicity at a particular location in the Earth is the average rate of seismic energy release per unit volume. The word tremor is also used for non-earthquake seismic rumbling. At the Earth's surface, earthquakes manifest themselves by shaking and displacing or disrupting the ground. When the epicenter of a large earthquake is located offshore, the seabed may be displaced sufficiently to cause a tsunami. Earthquakes can also trigger landslides. In its most general sense, the word earthquake is used to describe any seismic event—whether natural or caused by humans—that generates seismic waves. Earthquakes are caused mostly by rupture of geological faults but also by other events such as volcanic activity, landslides, mine blasts, and nuclear tests. An earthquake's point of initial rupture is called its hypocenter or focus. The epicenter is the point at ground level directly above the hypocenter. Tectonic earthquakes occur anywhere in the earth where there is sufficient stored elastic strain energy to drive fracture propagation along a fault plane. The sides of a fault move past each other smoothly and aseismically only if there are no irregularities or asperities along the fault surface that increase the frictional resistance. Most fault surfaces do have such asperities, which leads to a form of stick-slip behavior. Once the fault has locked, continued relative motion between the plates leads to increasing stress and, therefore, stored strain energy in the volume around the fault surface. This continues until the stress has risen sufficiently to break through the asperity, suddenly allowing sliding over the locked portion of the fault, releasing the stored energy. This energy is released as a combination of radiated elastic strain seismic waves, frictional heating of the fault surface, and cracking of the rock, thus causing an earthquake. This process of gradual build-up of strain and stress punctuated by occasional sudden earthquake failure is referred to as the elastic-rebound theory. It is estimated that only 10 percent or less of an earthquake's total energy is radiated as seismic energy. Most of the earthquake's energy is used to power the earthquake fracture growth or is converted into heat generated by friction. Therefore, earthquakes lower the Earth's available elastic potential energy and raise its temperature, though these changes are negligible compared to the conductive and convective flow of heat out from the Earth's deep interior."
EARTHQUAKES,"There are three main types of fault, all of which may cause an interplate earthquake: normal, reverse (thrust), and strike-slip. Normal and reverse faulting are examples of dip-slip, where the displacement along the fault is in the direction of dip and where movement on them involves a vertical component. Many earthquakes are caused by movement on faults that have components of both dip-slip and strike-slip; this is known as oblique slip. The topmost, brittle part of the Earth's crust, and the cool slabs of the tectonic plates that are descending into the hot mantle, are the only parts of our planet that can store elastic energy and release it in fault ruptures. Rocks hotter than about 300 °C (572 °F) flow in response to stress; they do not rupture in earthquakes. The maximum observed lengths of ruptures and mapped faults (which may break in a single rupture) are approximately 1,000 km (620 mi). Examples are the earthquakes in Alaska (1957), Chile (1960), and Sumatra (2004), all in subduction zones. The longest earthquake ruptures on strike-slip faults, like the San Andreas Fault (1857, 1906), the North Anatolian Fault in Turkey (1939), and the Denali Fault in Alaska (2002), are about half to one third as long as the lengths along subducting plate margins, and those along normal faults are even shorter. Normal faults occur mainly in areas where the crust is being extended such as a divergent boundary. Earthquakes associated with normal faults are generally less than magnitude 7. Maximum magnitudes along many normal faults are even more limited because many of them are located along spreading centers, as in Iceland, where the thickness of the brittle layer is only about six kilometres (3.7 mi). Reverse faults occur in areas where the crust is being shortened such as at a convergent boundary. Reverse faults, particularly those along convergent plate boundaries, are associated with the most powerful earthquakes, megathrust earthquakes, including almost all of those of magnitude 8 or more. Megathrust earthquakes are responsible for about 90% of the total seismic moment released worldwide. Strike-slip faults are steep structures where the two sides of the fault slip horizontally past each other; transform boundaries are a particular type of strike-slip fault. Strike-slip faults, particularly continental transforms, can produce major earthquakes up to about magnitude 8. Strike-slip faults tend to be oriented near vertically, resulting in an approximate width of 10 km (6.2 mi) within the brittle crust. Thus, earthquakes with magnitudes much larger than 8 are not possible. In addition, there exists a hierarchy of stress levels in the three fault types. Thrust faults are generated by the highest, strike-slip by intermediate, and normal faults by the lowest stress levels. This can easily be understood by considering the direction of the greatest principal stress, the direction of the force that ""pushes"" the rock mass during the faulting. In the case of normal faults, the rock mass is pushed down in a vertical direction, thus the pushing force (greatest principal stress) equals the weight of the rock mass itself. In the case of thrusting, the rock mass ""escapes"" in the direction of the least principal stress, namely upward, lifting the rock mass, and thus, the overburden equals the least principal stress. Strike-slip faulting is intermediate between the other two types described above. This difference in stress regime in the three faulting environments can contribute to differences in stress drop during faulting, which contributes to differences in the radiated energy, regardless of fault dimensions."
