STORMS,"When warm, moist air moves upward in an updraft, puffy cumulus clouds may form in the atmosphere. The moisture in the air condenses into water droplets as it rises. The cloud will continue to grow as long as warm air from below continues to rise. There are several ways that an updraft of warm moist air can form. Sometimes air is forced up the side of a mountain. Air is also forced upward at weather fronts, where warm and cool air masses collide. But often, updrafts form without a mountain or front to guide them — just because warm air rises. Air near the ground heats up during the day as energy from the Sun heats the ground, which then heats the air. The warmed air rises higher in the atmosphere because warm air has less mass than cool air, making it lighter. As the cumulus cloud continues to grow, the tiny water droplets within it grow larger as more water from the rising air is added to the droplets. The cloud starts to look dark and gray as more water is added to it, and the growing droplets that make up the cloud become heavy. Raindrops start to fall through the cloud when the rising air can no longer hold them up. Meanwhile, cool dry air flows downward in the cloud, called a downdraft, pulling water down as rain. With an updraft, downdraft, and rain, the cloud is now called a cumulonimbus cloud and the cycling of air up and down is called a thunderstorm cell. The moving air within the cloud builds up electric charges as it slides past other air. The buildup of electric charges allows lightning to form, much in the same way that you can create a spark after shuffling your feet on a carpet. Thunder is the sound that happens when lightning strikes. It often happens after you see the bolt of lightning because sound travels more slowly than light. When the downdrafts in the cloud become stronger than the updrafts, the storm starts to weaken. Since warm moist air can no longer rise, cloud droplets can no longer form. The storm dies out with light rain as the cloud disappears from bottom to top. The whole process takes about one hour for an ordinary thunderstorm. Severe thunderstorms like supercells and squall lines are much larger, more powerful, and last for several hours. An ice storm is a winter storm that has an accumulation of at least 6.35 mm (0.25 inch) of ice on all outdoor surfaces. The ice forms a slick layer on the ground that can make driving and walking dangerous and can cause branches and powerlines to snap due to the weight of the ice. There are different types of icy winter weather, which are determined by the temperature of air masses in the storm. Sleet forms when the snowflakes falling toward the surface first pass through a layer of air that is above freezing, which causes the snowflakes to partially melt, and then pass through a layer of air that is below freezing, which causes the snowflakes to re-freeze into pellets of ice. "
STORMS,"Winter storms begin with moist air rising up into the atmosphere, which is necessary for cloud formation and precipitation just like for other types of storms. Rising air is common at a cold front, where warm air is lifted above cold air, and can also happen as air moves up a large hill or mountain. A source of moisture, such as air blowing across a large lake or ocean and picking up water vapor, is necessary for clouds and precipitation to form. The final ingredient, and the one that makes a winter storm different from other storms, is cold air. Below-freezing air temperatures near the ground and up to the clouds will cause precipitation to fall as either snow or ice. However, extremely cold air is not able to hold as much moisture and thus will not make much snow. This explains why some of the coldest places on Earth, like Antarctica, receive very little precipitation throughout the year. Snowstorms are one type of winter storm. Blizzards are snowstorms with high winds, and lake effect storms are snowstorms that form near the Great Lakes. Ice storms can bring freezing rain or sleet as well as snow. Read below to learn more about the different kinds of winter storms. A storm where precipitation falls as snow is called a snowstorm. In the winter, most precipitation forms as snow within the clouds because temperatures at the top of the storm are cold enough to make snowflakes. Snowflakes are collections of frozen ice crystals that form as water vapor condenses into water droplets and freezes. These ice crystals stick together as they fall toward the ground, forming snowflakes. If the air temperature remains at or below 0℃ (32°F) between the cloud and the ground, the precipitation will fall as snow. If the air near the ground is above freezing, the precipitation will melt to form rain or freezing rain. A snowstorm where there is no accumulation beyond a light dusting of snow is called a snow flurry. A brief snowstorm with snow falling at varying intensity and some accumulation is called a snow shower. If the snow showers are accompanied by strong gusts of wind and accumulation of lots of snow, they are called snow squalls. A blizzard is considered a severe kind of snowstorm and is described in more detail below."
TSUNAMI,"A tsunami (/(t)suːˈnɑːmi,  (t)suu- from Japanese: harbour wave, pronounced [tsɯnami]) is a series of waves in a water body caused by the displacement of a large volume of water, generally in an ocean or a large lake. Earthquakes, volcanic eruptions and other underwater explosions (including detonations, landslides, glacier calvings, meteorite impacts and other disturbances) above or below water all have the potential to generate a tsunami.[6] Unlike normal ocean waves, which are generated by wind, or tides, which are in turn generated by the gravitational pull of the Moon and the Sun, a tsunami is generated by the displacement of water from a large event. Tsunami waves do not resemble normal undersea currents or sea waves because their wavelength is far longer.[7] Rather than appearing as a breaking wave, a tsunami may instead initially resemble a rapidly rising tide.[8] For this reason, it is often referred to as a tidal wave,[9] although this usage is not favoured by the scientific community because it might give the false impression of a causal relationship between tides and tsunamis.[10] Tsunamis generally consist of a series of waves, with periods ranging from minutes to hours, arriving in a so-called ""wave train"".[11] Wave heights of tens of metres can be generated by large events. Although the impact of tsunamis is limited to coastal areas, their destructive power can be enormous, and they can affect entire ocean basins. The 2004 Indian Ocean tsunami was among the deadliest natural disasters in human history, with at least 230,000 people killed or missing in 14 countries bordering the Indian Ocean. The Ancient Greek historian Thucydides suggested in his 5th century BC History of the Peloponnesian War that tsunamis were related to submarine earthquakes, but the understanding of tsunamis remained slim until the 20th century, and much remains unknown. Major areas of current research include determining why some large earthquakes do not generate tsunamis while other smaller ones do. This ongoing research is designed to help accurately forecast the passage of tsunamis across oceans as well as how tsunami waves interact with shorelines."
TSUNAMI,"The term ""tsunami"" is a borrowing from the Japanese tsunami, meaning ""harbour wave."" For the plural, one can either follow ordinary English practice and add an s, or use an invariable plural as in the Japanese. Some English speakers alter the word's initial /ts/ to an /s/ by dropping the ""t,"" since English does not natively permit /ts/ at the beginning of words, though the original Japanese pronunciation is /ts/. Tsunamis are sometimes referred to as tidal waves.[15] This once-popular term derives from the most common appearance of a tsunami, which is that of an extraordinarily high tidal bore. Tsunamis and tides both produce waves of water that move inland, but in the case of a tsunami, the inland movement of water may be much greater, giving the impression of an incredibly high and forceful tide. In recent years, the term ""tidal wave"" has fallen out of favour, especially in the scientific community, because the causes of tsunamis have nothing to do with those of tides, which are produced by the gravitational pull of the moon and sun rather than the displacement of water. Although the meanings of ""tidal"" include ""resembling""[16] or ""having the form or character of""[17] tides, use of the term tidal wave is discouraged by geologists and oceanographers. A 1969 episode of the TV crime show Hawaii Five-O entitled ""Forty Feet High and It Kills!"" used the terms ""tsunami"" and ""tidal wave"" interchangeably. The term seismic sea wave is also used to refer to the phenomenon because the waves most often are generated by seismic activity such as earthquakes.[19] Prior to the rise of the use of the term tsunami in English, scientists generally encouraged the use of the term seismic sea wave rather than tidal wave. However, like tsunami, seismic sea wave is not a completely accurate term, as forces other than earthquakes—including underwater landslides, volcanic eruptions, underwater explosions, land or ice slumping into the ocean, meteorite impacts, and the weather when the atmospheric pressure changes very rapidly—can generate such waves by displacing water."
TSUNAMI,"While Japan may have the longest recorded history of tsunamis, the sheer destruction caused by the 2004 Indian Ocean earthquake and tsunami event mark it as the most devastating of its kind in modern times, killing around 230,000 people. The Sumatran region is also accustomed to tsunamis, with earthquakes of varying magnitudes regularly occurring off the coast of the island. Tsunamis are an often underestimated hazard in the Mediterranean Sea and parts of Europe. Of historical and current (with regard to risk assumptions) importance are the 1755 Lisbon earthquake and tsunami (which was caused by the Azores–Gibraltar Transform Fault), the 1783 Calabrian earthquakes, each causing several tens of thousands of deaths and the 1908 Messina earthquake and tsunami. The tsunami claimed more than 123,000 lives in Sicily and Calabria and is among the most deadly natural disasters in modern Europe. The Storegga Slide in the Norwegian Sea and some examples of tsunamis affecting the British Isles refer to landslide and meteotsunamis predominantly and less to earthquake-induced waves. As early as 426 BC the Greek historian Thucydides inquired in his book History of the Peloponnesian War about the causes of tsunami, and was the first to argue that ocean earthquakes must be the cause. The oldest human record of a tsunami dates back to 479 BC, in the Greek colony of Potidaea, thought to be triggered by an earthquake. The tsunami may have saved the colony from an invasion by the Achaemenid Empire. The cause, in my opinion, of this phenomenon must be sought in the earthquake. At the point where its shock has been the most violent the sea is driven back, and suddenly recoiling with redoubled force, causes the inundation. Without an earthquake I do not see how such an accident could happen. The Roman historian Ammianus Marcellinus (Res Gestae 26.10.15–19) described the typical sequence of a tsunami, including an incipient earthquake, the sudden retreat of the sea and a following gigantic wave, after the 365 AD tsunami devastated Alexandria."
TSUNAMI,"The principal generation mechanism of a tsunami is the displacement of a substantial volume of water or perturbation of the sea. This displacement of water is usually caused by earthquakes, but can also be attributed to landslides, volcanic eruptions, glacier calvings or more rarely by meteorites and nuclear tests. However, the possibility of a meteorite causing a tsunami is debated. Tsunamis can be generated when the sea floor abruptly deforms and vertically displaces the overlying water. Tectonic earthquakes are a particular kind of earthquake that are associated with the Earth's crustal deformation; when these earthquakes occur beneath the sea, the water above the deformed area is displaced from its equilibrium position. More specifically, a tsunami can be generated when thrust faults associated with convergent or destructive plate boundaries move abruptly, resulting in water displacement, owing to the vertical component of movement involved. Movement on normal (extensional) faults can also cause displacement of the seabed, but only the largest of such events (typically related to flexure in the outer trench swell) cause enough displacement to give rise to a significant tsunami, such as the 1977 Sumba and 1933 Sanriku events. Tsunamis have a small wave height offshore, and a very long wavelength (often hundreds of kilometres long, whereas normal ocean waves have a wavelength of only 30 or 40 metres),[37] which is why they generally pass unnoticed at sea, forming only a slight swell usually about 300 millimetres (12 in) above the normal sea surface. They grow in height when they reach shallower water, in a wave shoaling process described below. A tsunami can occur in any tidal state and even at low tide can still inundate coastal areas."
TSUNAMI,"On April 1, 1946, the Aleutian Islands earthquake occurred with a maximum Mercalli intensity of VI (Strong). It generated a tsunami which inundated Hilo on the island of Hawaii with a 14-metre high (46 ft) surge. Between 165 and 173 were killed. The area where the earthquake occurred is where the Pacific Ocean floor is subducting (or being pushed downwards) under Alaska. Examples of tsunamis originating at locations away from convergent boundaries include Storegga about 8,000 years ago, Grand Banks in 1929, and Papua New Guinea in 1998 (Tappin, 2001). The Grand Banks and Papua New Guinea tsunamis came from earthquakes which destabilised sediments, causing them to flow into the ocean and generate a tsunami. They dissipated before travelling transoceanic distances. The cause of the Storegga sediment failure is unknown. Possibilities include an overloading of the sediments, an earthquake or a release of gas hydrates (methane etc.). The 1960 Valdivia earthquake (Mw 9.5), 1964 Alaska earthquake (Mw 9.2), 2004 Indian Ocean earthquake (Mw 9.2), and 2011 Tōhoku earthquake (Mw9.0) are recent examples of powerful megathrust earthquakes that generated tsunamis (known as teletsunamis) that can cross entire oceans. Smaller (Mw 4.2) earthquakes in Japan can trigger tsunamis (called local and regional tsunamis) that can devastate stretches of coastline, but can do so in only a few minutes at a time. The Tauredunum event was a large tsunami on Lake Geneva in 563 CE, caused by sedimentary deposits destabilized by a landslide. In the 1950s, it was discovered that tsunamis larger than had previously been believed possible can be caused by giant submarine landslides. These large volumes of rapidly displaced water transfer energy at a faster rate than the water can absorb. Their existence was confirmed in 1958, when a giant landslide in Lituya Bay, Alaska, caused the highest wave ever recorded, which had a height of 524 metres (1,719 ft).[38] The wave did not travel far as it struck land almost immediately. The wave struck three boats—each with two people aboard—anchored in the bay. One boat rode out the wave, but the wave sank the other two, killing both people aboard one of them."
TSUNAMI,"Another landslide-tsunami event occurred in 1963 when a massive landslide from Monte Toc entered the reservoir behind the Vajont Dam in Italy. The resulting wave surged over the 262-metre (860 ft)-high dam by 250 metres (820 ft) and destroyed several towns. Around 2,000 people died.[42][43] Scientists named these waves megatsunamis. Some geologists claim that large landslides from volcanic islands, e.g. Cumbre Vieja on La Palma (Cumbre Vieja tsunami hazard) in the Canary Islands, may be able to generate megatsunamis that can cross oceans, but this is disputed by many others. In general, landslides generate displacements mainly in the shallower parts of the coastline, and there is conjecture about the nature of large landslides that enter the water. This has been shown to subsequently affect water in enclosed bays and lakes, but a landslide large enough to cause a transoceanic tsunami has not occurred within recorded history. Susceptible locations are believed to be the Big Island of Hawaii, Fogo in the Cape Verde Islands, La Reunion in the Indian Ocean, and Cumbre Vieja on the island of La Palma in the Canary Islands; along with other volcanic ocean islands. This is because large masses of relatively unconsolidated volcanic material occurs on the flanks and in some cases detachment planes are believed to be developing. However, there is growing controversy about how dangerous these slopes actually are. Other than by landslides or sector collapse, volcanoes may be able to generate waves by pyroclastic flow submergence, caldera collapse, or underwater explosions.[45] Tsunamis have been triggered by a number of volcanic eruptions, including the 1883 eruption of Krakatoa, and the 2022 Hunga Tonga–Hunga Ha'apai eruption. Over 20% of all fatalities caused by volcanism during the past 250 years are estimated to have been caused by volcanogenic tsunamis. Storm surges and setup are also dangerous causes of coastal flooding in severe weather but their dynamics are completely unrelated to tsunami waves. They are unable to propagate beyond their sources, as waves do."
TSUNAMI,"Debate has persisted over the origins and source mechanisms of these types of tsunamis, such as those generated by Krakatoa in 1883,[46] and they remain lesser understood than their seismic relatives. This poses a large problem of awareness and preparedness, as exemplified by the eruption and collapse of Anak Krakatoa in 2018, which killed 426 and injured thousands when no warning was available. It is still regarded that lateral landslides and ocean-entering pyroclastic currents are most likely to generate the largest and most hazardous waves from volcanism;[47] however, field investigation of the Tongan event, as well as developments in numerical modelling methods, currently aim to expand the understanding of the other source mechanisms. Some meteorological conditions, especially rapid changes in barometric pressure, as seen with the passing of a front, can displace bodies of water enough to cause trains of waves with wavelengths. These are comparable to seismic tsunamis, but usually with lower energies. Essentially, they are dynamically equivalent to seismic tsunamis, the only differences being 1) that meteotsunamis lack the transoceanic reach of significant seismic tsunamis, and 2) that the force that displaces the water is sustained over some length of time such that meteotsunamis cannot be modelled as having been caused instantaneously. In spite of their lower energies, on shorelines where they can be amplified by resonance, they are sometimes powerful enough to cause localised damage and potential for loss of life. They have been documented in many places, including the Great Lakes, the Aegean Sea, the English Channel, and the Balearic Islands, where they are common enough to have a local name, rissaga. In Sicily they are called marubbio and in Nagasaki Bay, they are called abiki. Some examples of destructive meteotsunamis include 31 March 1979 at Nagasaki and 15 June 2006 at Menorca, the latter causing damage in the tens of millions of euros. Meteotsunamis should not be confused with storm surges, which are local increases in sea level associated with the low barometric pressure of passing tropical cyclones, nor should they be confused with setup, the temporary local raising of sea level caused by strong on-shore winds. "
TSUNAMI,"There have been studies of the potential of the induction of and at least one actual attempt to create tsunami waves as a tectonic weapon. In World War II, the New Zealand Military Forces initiated Project Seal, which attempted to create small tsunamis with explosives in the area of today's Shakespear Regional Park; the attempt failed. There has been considerable speculation on the possibility of using nuclear weapons to cause tsunamis near an enemy coastline. Even during World War II consideration of the idea using conventional explosives was explored. Nuclear testing in the Pacific Proving Ground by the United States seemed to generate poor results. Operation Crossroads fired two 20 kilotonnes of TNT (84 TJ) bombs, one in the air and one underwater, above and below the shallow (50 m (160 ft)) waters of the Bikini Atoll lagoon. Fired about 6 km (3.7 mi) from the nearest island, the waves there were no higher than 3–4 m (9.8–13.1 ft) upon reaching the shoreline. Other underwater tests, mainly Hardtack I/Wahoo (deep water) and Hardtack I/Umbrella (shallow water) confirmed the results. Analysis of the effects of shallow and deep underwater explosions indicate that the energy of the explosions does not easily generate the kind of deep, all-ocean waveforms which are tsunamis; most of the energy creates steam, causes vertical fountains above the water, and creates compressional waveforms.[52] Tsunamis are hallmarked by permanent large vertical displacements of very large volumes of water which do not occur in explosions. Tsunamis are caused by earthquakes, landslides, volcanic explosions, glacier calvings, and bolides. They cause damage by two mechanisms: the smashing force of a wall of water travelling at high speed, and the destructive power of a large volume of water draining off the land and carrying a large amount of debris with it, even with waves that do not appear to be large."
TSUNAMI,"While everyday wind waves have a wavelength (from crest to crest) of about 100 metres (330 ft) and a height of roughly 2 metres (6.6 ft), a tsunami in the deep ocean has a much larger wavelength of up to 200 kilometres (120 mi). Such a wave travels at well over 800 kilometres per hour (500 mph), but owing to the enormous wavelength the wave oscillation at any given point takes 20 or 30 minutes to complete a cycle and has an amplitude of only about 1 metre (3.3 ft).[53] This makes tsunamis difficult to detect over deep water, where ships are unable to feel their passage. The velocity of a tsunami can be calculated by obtaining the square root of the depth of the water in metres multiplied by the acceleration due to gravity (approximated to 10 m/s2). For example, if the Pacific Ocean is considered to have a depth of 5000 metres, the velocity of a tsunami would be √5000 × 10 = √50000 ≈ 224 metres per second (730 ft/s), which equates to a speed of about 806 kilometres per hour (501 mph). This is the formula used for calculating the velocity of shallow-water waves. Even the deep ocean is shallow in this sense because a tsunami wave is so long (horizontally from crest to crest) by comparison. The reason for the Japanese name ""harbour wave"" is that sometimes a village's fishermen would sail out, and encounter no unusual waves while out at sea fishing, and come back to land to find their village devastated by a huge wave. As the tsunami approaches the coast and the waters become shallow, wave shoaling compresses the wave and its speed decreases below 80 kilometres per hour (50 mph). Its wavelength diminishes to less than 20 kilometres (12 mi) and its amplitude grows enormously—in accord with Green's law. Since the wave still has the same very long period, the tsunami may take minutes to reach full height. Except for the very largest tsunamis, the approaching wave does not break, but rather appears like a fast-moving tidal bore. Open bays and coastlines adjacent to very deep water may shape the tsunami further into a step-like wave with a steep-breaking front."
